{
  "$schema": "https://json-schema.org/draft/2020-12/schema",
  "$id": "https://chirp.dev/schemas/catalog-v3.schema.json",
  "title": "Document Catalog Protocol catalog.json v3",
  "description": "Interchange schema for Furatena federated catalog exports (DCP Tier 1 + Tier 2).",
  "type": "object",
  "required": ["schema_version", "channel", "page_count", "pages", "edges", "namespaces"],
  "additionalProperties": true,
  "properties": {
    "schema_version": { "type": "integer", "const": 3 },
    "version": { "type": "integer" },
    "channel": { "type": "string" },
    "edition": { "type": "string" },
    "page_count": { "type": "integer", "minimum": 0 },
    "mount": { "type": "string" },
    "pages": {
      "type": "array",
      "items": { "$ref": "#/$defs/page" }
    },
    "edges": {
      "type": "array",
      "items": { "$ref": "#/$defs/edge" }
    },
    "graph_nodes": {
      "type": "array",
      "items": { "$ref": "#/$defs/graph_node" }
    },
    "namespaces": {
      "type": "array",
      "items": { "$ref": "#/$defs/namespace" }
    },
    "inventories": {
      "type": "array",
      "items": { "$ref": "#/$defs/inventory" }
    },
    "structure_index": { "$ref": "#/$defs/structure_index" }
  },
  "$defs": {
    "page": {
      "type": "object",
      "required": ["node_id", "url", "slug", "title", "mount", "edition"],
      "additionalProperties": true,
      "properties": {
        "node_id": { "type": "string", "pattern": "^[^:]+:[^:]+:.*$" },
        "url": { "type": "string" },
        "slug": { "type": "string" },
        "title": { "type": "string" },
        "description": { "type": "string" },
        "section": { "type": "string" },
        "weight": { "type": "integer" },
        "tags": { "type": "array", "items": { "type": "string" } },
        "source_path": { "type": "string" },
        "source": { "type": "string" },
        "source_kind": { "enum": ["filesystem", "generated"] },
        "source_provider": { "type": ["string", "null"] },
        "source_repo": { "type": ["string", "null"] },
        "source_ref": { "type": ["string", "null"] },
        "source_url": { "type": ["string", "null"] },
        "generated_from": { "type": ["string", "null"] },
        "owner": { "type": ["string", "null"] },
        "team": { "type": ["string", "null"] },
        "tenant": { "type": ["string", "null"] },
        "workspace": { "type": ["string", "null"] },
        "site": { "type": ["string", "null"] },
        "output_channel": { "type": ["string", "null"] },
        "last_indexed_at": { "type": ["string", "null"] },
        "provenance": {
          "type": "object",
          "properties": {
            "provider": { "type": ["string", "null"] },
            "repo": { "type": ["string", "null"] },
            "ref": { "type": ["string", "null"] },
            "source_url": { "type": ["string", "null"] },
            "path": { "type": "string" },
            "generated_from": { "type": ["string", "null"] },
            "owner": { "type": ["string", "null"] },
            "team": { "type": ["string", "null"] },
            "mount": { "type": "string" },
            "edition": { "type": "string" },
            "tenant": { "type": ["string", "null"] },
            "workspace": { "type": ["string", "null"] },
            "site": { "type": ["string", "null"] },
            "output_channel": { "type": ["string", "null"] },
            "last_indexed_at": { "type": ["string", "null"] }
          }
        },
        "api_operation": {
          "type": ["object", "null"],
          "properties": {
            "operation_id": { "type": "string" },
            "method": { "type": "string" },
            "path": { "type": "string" },
            "summary": { "type": "string" },
            "tags": { "type": "array", "items": { "type": "string" } },
            "schemas": { "type": "array", "items": { "type": "string" } },
            "request_bodies": { "type": "array", "items": { "type": "string" } },
            "responses": { "type": "array", "items": { "type": "string" } },
            "examples": { "type": "array", "items": { "type": "string" } },
            "auth": { "type": "array", "items": { "type": "string" } },
            "environments": { "type": "array", "items": { "type": "string" } },
            "external_docs": {
              "type": "array",
              "items": {
                "type": "object",
                "properties": {
                  "url": { "type": "string" },
                  "description": { "type": "string" }
                },
                "required": ["url"]
              }
            },
            "source_spec": { "type": "string" }
          }
        },
        "api_try_it": {
          "type": ["object", "null"],
          "properties": {
            "schema_version": { "type": "integer" },
            "operation_id": { "type": "string" },
            "modes": {
              "type": "array",
              "items": {
                "type": "object",
                "properties": {
                  "id": { "enum": ["static", "mock", "live"] },
                  "available": { "type": "boolean" },
                  "request_behavior": { "type": "string" },
                  "requires": { "type": "array", "items": { "type": "string" } },
                  "proxy_path": { "type": ["string", "null"] },
                  "disabled_reason": { "type": "string" }
                },
                "required": ["id", "available", "request_behavior", "requires"]
              }
            },
            "boundaries": {
              "type": "object",
              "properties": {
                "tenant": { "type": "string" },
                "site": { "type": "string" },
                "mount": { "type": "string" },
                "source_spec": { "type": "string" }
              },
              "required": ["tenant", "site", "mount", "source_spec"]
            },
            "base_urls": {
              "type": "array",
              "items": {
                "type": "object",
                "properties": {
                  "id": { "type": "string" },
                  "label": { "type": "string" },
                  "url": { "type": "string" },
                  "scope": { "type": "string" },
                  "base_url_env": { "type": ["string", "null"] }
                },
                "required": ["id", "label", "scope"]
              }
            },
            "auth": {
              "type": "array",
              "items": {
                "type": "object",
                "properties": {
                  "scheme": { "type": "string" },
                  "token_ref": { "type": ["string", "null"] },
                  "storage": { "type": "string" },
                  "exposed_to_static": { "type": "boolean" },
                  "configured": { "type": "boolean" }
                },
                "required": ["scheme", "storage", "exposed_to_static", "configured"]
              }
            },
            "static_export": {
              "type": "object",
              "properties": {
                "live_requests": { "type": "string" },
                "fallback_mode": { "type": "string" },
                "reason": { "type": "string" }
              },
              "required": ["live_requests", "fallback_mode", "reason"]
            }
          },
          "required": ["schema_version", "operation_id", "modes", "boundaries", "base_urls", "auth", "static_export"]
        },
        "content_format": { "type": "string" },
        "doc_version": { "type": ["string", "null"] },
        "mount": { "type": "string" },
        "edition": { "type": "string" },
        "section_root": { "type": "boolean" },
        "body_md": { "type": "string" },
        "body_source": { "type": "string" },
        "body_text": { "type": "string" },
        "toc": {
          "type": "array",
          "items": {
            "type": "object",
            "required": ["anchor", "text", "depth"],
            "properties": {
              "anchor": { "type": "string" },
              "text": { "type": "string" },
              "depth": { "type": "integer", "minimum": 1 }
            }
          }
        },
        "backlinks": {
          "type": "array",
          "items": {
            "type": "object",
            "required": ["title", "href"],
            "properties": {
              "title": { "type": "string" },
              "href": { "type": "string" }
            }
          }
        },
        "content": { "$ref": "#/$defs/content_ir" },
        "sections": {
          "type": "array",
          "items": {
            "type": "object",
            "required": ["id", "heading", "depth", "text"],
            "properties": {
              "id": { "type": "string" },
              "heading": { "type": "string" },
              "depth": { "type": "integer" },
              "text": { "type": "string" }
            }
          }
        },
        "ast_path": { "type": "string" },
        "native_ast": {
          "type": "object",
          "required": ["format", "path"],
          "properties": {
            "format": { "type": "string" },
            "path": { "type": "string" }
          }
        }
      }
    },
    "content_ir": {
      "type": "object",
      "properties": {
        "headings": {
          "type": "array",
          "items": {
            "type": "object",
            "required": ["level", "text", "anchor", "line"],
            "properties": {
              "level": { "type": "integer", "minimum": 1 },
              "text": { "type": "string" },
              "anchor": { "type": "string" },
              "line": { "type": "integer", "minimum": 1 }
            }
          }
        },
        "links": {
          "type": "array",
          "items": {
            "type": "object",
            "required": ["href", "text", "line"],
            "properties": {
              "href": { "type": "string" },
              "text": { "type": "string" },
              "line": { "type": "integer", "minimum": 1 }
            }
          }
        },
        "extensions": {
          "type": "array",
          "items": { "$ref": "#/$defs/extension" }
        },
        "directives": {
          "type": "array",
          "items": { "$ref": "#/$defs/extension" }
        }
      }
    },
    "extension": {
      "type": "object",
      "required": ["name", "line"],
      "properties": {
        "name": { "type": "string" },
        "options": { "type": "object" },
        "line": { "type": "integer", "minimum": 1 }
      }
    },
    "edge": {
      "type": "object",
      "required": ["source", "target", "kind"],
      "properties": {
        "source": { "type": "string" },
        "target": { "type": "string" },
        "kind": {
          "enum": [
            "api_auth",
            "api_environment",
            "api_example",
            "api_request_body",
            "api_response",
            "api_schema",
            "api_tag",
            "available_in",
            "breaks",
            "explains",
            "generated_from",
            "implements",
            "link",
            "nav_next",
            "nav_prev",
            "owned_by",
            "parent",
            "requires",
            "supersedes",
            "tag",
            "translation",
            "validates"
          ]
        },
        "mount": { "type": "string" },
        "edition": { "type": "string" }
      }
    },
    "graph_node": {
      "type": "object",
      "required": ["id", "kind", "label"],
      "properties": {
        "id": { "type": "string" },
        "kind": {
          "enum": [
            "api_auth",
            "api_environment",
            "api_example",
            "api_operation",
            "api_request_body",
            "api_response",
            "api_schema",
            "api_tag",
            "release",
            "source_file"
          ]
        },
        "label": { "type": "string" },
        "mount": { "type": "string" },
        "edition": { "type": "string" }
      }
    },
    "namespace": {
      "type": "object",
      "required": ["mount", "label", "edition", "page_count"],
      "properties": {
        "mount": { "type": "string" },
        "label": { "type": "string" },
        "edition": { "type": "string" },
        "page_count": { "type": "integer", "minimum": 0 },
        "tenant": { "type": ["string", "null"] },
        "workspace": { "type": ["string", "null"] },
        "site": { "type": ["string", "null"] }
      }
    },
    "inventory": {
      "type": "object",
      "required": ["id"],
      "properties": {
        "id": { "type": "string" },
        "url": { "type": "string" },
        "format": { "type": "string" }
      }
    },
    "structure_index": {
      "type": "object",
      "required": ["schema_version", "directive_count", "heading_count"],
      "properties": {
        "schema_version": { "type": "integer" },
        "directive_count": { "type": "integer", "minimum": 0 },
        "heading_count": { "type": "integer", "minimum": 0 },
        "directive_names": {
          "type": "array",
          "items": { "type": "string" }
        }
      }
    }
  }
}
