{"channel":"0.10.3","edition":"0.10.3","edges":[],"mount":"chirp","namespaces":[],"page_count":1,"pages":[{"content":{"directives":[],"extensions":[],"headings":[{"anchor":"guide","level":1,"line":1,"text":"Guide"}],"links":[]},"edition":"0.10.3","mount":"chirp","node_id":"chirp:0.10.3:guide","sections":[{"depth":1,"heading":"Guide","id":"guide","text":"Published fragment."}],"slug":"guide","title":"Guide","url":"/chirp/0.10.3/guide/"}],"schema_version":3}
